{
  "$schema": "http://json-schema.org/draft-07/schema#",
  "title": "NPC Data Schema",
  "type": "array",
  "description": "Schema for defining NPCs (Non-Player Characters) data for the NPC Generator.",
  "items": {
    "description": "Schema for a single NPC",
    "properties": {
      "metadata": {
        "type": "object",
        "description": "Metadata about the NPC data.",
        "properties": {
          "version": {
            "type": "string",
            "description": "Version of the NPC data format.",
            "default": "1.0"
          },
          "author": {
            "type": "string",
            "description": "Author of the NPC data."
          },
          "created_at": {
            "type": "string",
            "format": "date-time",
            "description": "Date and time when the NPC data was created."
          },
          "notes": {
            "type": "string",
            "description": "Additional notes about the NPC."
          }
        },
        "additionalProperties": false
      },
      "attributes": {
        "type": "object",
        "description": "Core attributes of the NPC.",
        "properties": {
          "name": {
            "type": "string",
            "description": "The NPC's name.",
            "minLength": 1
          },
          "role": {
            "type": "string",
            "description": "The NPC's role or title."
          },
          "description": {
            "type": "string",
            "description": "A description of the NPC."
          },
          "portrait": {
            "type": "string",
            "format": "uri",
            "description": "URI to the NPC's portrait image."
          },
          "appearance": {
            "type": "string",
            "description": "Description of the NPC's physical appearance."
          },
          "race": {
            "type": "string",
            "description": "The NPC's race or species."
          },
          "class": {
            "type": "string",
            "description": "The NPC's class or profession."
          },
          "age": {
            "type": ["integer", "string"],
            "description": "The NPC's age."
          },
          "personality": {
            "type": "string",
            "description": "Description of the NPC's personality."
          },
          "quirks": {
            "type": "string",
            "description": "Any quirks or unique behaviors the NPC exhibits."
          },
          "alignment": {
            "type": "string",
            "description": "The NPC's moral and ethical alignment.",
            "enum": [
              "Lawful Good",
              "Neutral Good",
              "Chaotic Good",
              "Lawful Neutral",
              "True Neutral",
              "Chaotic Neutral",
              "Lawful Evil",
              "Neutral Evil",
              "Chaotic Evil"
            ]
          },
          "background": {
            "type": "string",
            "description": "Background story of the NPC."
          },
          "additional_info": {
            "type": "object",
            "description": "Additional information about the NPC.",
            "additionalProperties": true
          }
        },
        "required": ["name"],
        "additionalProperties": false
      },
      "stat_blocks": {
        "type": "array",
        "description": "Array of stat blocks containing the NPC's statistics.",
        "items": {
          "type": "object",
          "properties": {
            "title": {
              "type": "string",
              "description": "Title of the stat block (e.g., 'Primary Stat Block')."
            },
            "abilities": {
              "type": "object",
              "description": "Ability scores of the NPC.",
              "properties": {
                "strength": {
                  "type": "integer",
                  "description": "Strength score.",
                  "minimum": 1,
                  "maximum": 30
                },
                "dexterity": {
                  "type": "integer",
                  "description": "Dexterity score.",
                  "minimum": 1,
                  "maximum": 30
                },
                "constitution": {
                  "type": "integer",
                  "description": "Constitution score.",
                  "minimum": 1,
                  "maximum": 30
                },
                "intelligence": {
                  "type": "integer",
                  "description": "Intelligence score.",
                  "minimum": 1,
                  "maximum": 30
                },
                "wisdom": {
                  "type": "integer",
                  "description": "Wisdom score.",
                  "minimum": 1,
                  "maximum": 30
                },
                "charisma": {
                  "type": "integer",
                  "description": "Charisma score.",
                  "minimum": 1,
                  "maximum": 30
                }
              },
              "required": ["strength", "dexterity", "constitution", "intelligence", "wisdom", "charisma"],
              "additionalProperties": false
            },
            "armor_class": {
              "type": ["integer", "string"],
              "description": "Armor Class (AC) of the NPC."
            },
            "hit_points": {
              "type": ["integer", "string"],
              "description": "Hit Points (HP) of the NPC."
            },
            "speed": {
              "type": "string",
              "description": "Speed of the NPC (e.g., '30 ft.').",
              "pattern": "^\\d+\\s*ft\\.$"
            },
            "skills": {
              "type": "array",
              "description": "List of the NPC's skills and associated modifiers.",
              "items": {
                "type": "string"
              }
            },
            "senses": {
              "type": "string",
              "description": "Senses the NPC possesses (e.g., 'Darkvision 60 ft.')."
            },
            "languages": {
              "type": "array",
              "description": "Languages the NPC can speak or understand.",
              "items": {
                "type": "string"
              }
            },
            "challenge_rating": {
              "type": ["integer", "number", "string"],
              "description": "Challenge Rating (CR) of the NPC."
            },
            "special_abilities": {
              "type": "array",
              "description": "List of special abilities the NPC possesses.",
              "items": {
                "type": "object",
                "properties": {
                  "name": {
                    "type": "string",
                    "description": "Name of the special ability."
                  },
                  "description": {
                    "type": "string",
                    "description": "Description of the special ability."
                  },
                  "metadata": {
                    "type": "object",
                    "description": "Additional data related to the special ability.",
                    "additionalProperties": true
                  }
                },
                "required": ["name", "description"],
                "additionalProperties": false
              }
            }
          },
          "required": ["title", "abilities"],
          "additionalProperties": false
        }
      },
      "custom_fields": {
        "type": "object",
        "description": "User-defined custom fields for additional information.",
        "additionalProperties": true
      },
      "template_instructions": {
        "type": "object",
        "description": "Instructions for how the NPC data should be rendered.",
        "properties": {
          "layout": {
            "type": "string",
            "description": "Specifies the template layout to use.",
            "enum": ["detailed", "simple", "compact"],
            "default": "detailed"
          },
          "sections": {
            "type": "array",
            "description": "List of sections to include in the output.",
            "items": {
              "type": "string",
              "enum": ["attributes", "stat_blocks", "custom_fields", "metadata"]
            },
            "default": ["attributes", "stat_blocks", "custom_fields", "metadata"]
          },
          "field_formatting": {
            "type": "object",
            "description": "Formatting instructions for specific fields.",
            "additionalProperties": {
              "type": "object",
              "properties": {
                "display_name": {
                  "type": "string",
                  "description": "Custom display name for the field."
                },
                "location": {
                  "type": "string",
                  "description": "Location where the field should be displayed.",
                  "enum": ["header", "body", "footer", "sidebar", "stat_block"],
                  "default": "body"
                },
                "format": {
                  "type": "string",
                  "description": "Format in which the field should be rendered.",
                  "enum": ["text", "table", "list", "accordion", "grid"],
                  "default": "text"
                },
                "display": {
                  "type": "boolean",
                  "description": "Whether to display or not display the section.",
                  "default": "true"  
                }
              },
              "additionalProperties": false
            }
          }
        },
        "additionalProperties": false
      },
      "icons": {
        "type": "object",
        "description": "Mapping of icon placeholders to icon image URIs.",
        "additionalProperties": {
          "type": "string",
          "format": "uri",
          "description": "URI to the icon image."
        }
      }
    },
    "required": ["attributes"],
    "additionalProperties": false
  }
}
